dt,source,domain,url,title,summary,image,brief,body,raw_page,from
2013-03-28,中安在线,,http://news.sina.com.cn/o/2013-03-28/043126662998.shtml,“安徽第一路”将实施立面改造,,,长江中路，以及合肥重要的金融、商务区之一的北一环将进行立面改造，改造后的长江中路计划以米黄色为底色，街头小景凸显徽文化，北一环则将与现代服务业结合，更添现代与大气 ...,,,
2013-03-28,中安在线,,http://news.sina.com.cn/o/2013-03-28/033026662775.shtml,去三孝口东北角拜读《合肥赋》吧,,,将对长江中路与北一环进行大规模的沿街建筑立面改造，打造全新街景。改造后的长江中路计划以米黄色为底色，《合肥赋》、《三孝口故事》等将为其增添徽文化韵味。,,,
2013-03-20,中安在线,,http://news.sina.com.cn/o/p/2013-03-20/164026589900.shtml,跑西高架可赏“顶上风光”（图）,,,在该生态示范区范围内，囊括了樊洼路公园、董铺水库南岸湿地公园、合肥城市公园(徽文化主题)、蜀麓公园、植物园、植物园南扩公园、井岗镇现代农业生态示范园、科学岛路造林、环湖大 ...,,,
2013-03-20,中安在线,,http://news.sina.com.cn/o/2013-03-20/044926582406.shtml,我省两所高校学历获台湾认可,,,科研合作和参加学术会议、研习培训；自2007年以来，该校共主办了六届“大学生徽文化研习营”，先后邀请并接待了台湾师生247人次来该校交流访问。,,,
2013-03-18,新安晚报,,http://news.sina.com.cn/o/2013-03-18/080026562438.shtml,热线：400-0551-229 网址：www.ahjuhui.com,,,市场费用厂家承担。厂址：古井镇 0558-5366939、13030643777 徽文化特色礼品定制专家！生肖贺岁金银贵金属产品隆重发行！安徽省最好的皮肤病医院 疑难皮肤病总会诊 保和堂专线：0551-62838116 ...,,,
2013-03-18,中安在线,,http://news.sina.com.cn/o/2013-03-18/043926560515.shtml,安徽地域文化五个特点解析,,,徽州文化、皖江文化中，主导的则是儒家文化。三大亚文化区域的差异性，使安徽文化显示出丰富性和多样性。另一方面，三个区域的文化也有趋同性。,,,
2013-03-15,中国文化报,,http://collection.sina.com.cn/plfx/20130315/0817106979.shtml,徽州古民居保护杜绝瞎拆瞎建,,,很多古民居的现状堪忧。祖宗留下的产业不能糟蹋 徽文化中能让大家最直观地感受到的就是徽州的古村落、古民居，这是老祖宗留下的丰厚遗产。,,,
2013-03-14,中安在线,,http://news.sina.com.cn/o/2013-03-14/151926532136.shtml,黄山市经济开发区加快推进转型发展,,,同比增长21%。加快项目建设。强力推进徽文化产业园建设，加快蓝猫动漫产业基地建设，争取再引入4-5家制墨、制笔企业，丰富产业园业态。,,,
2013-03-14,中安在线,,http://news.sina.com.cn/o/p/2013-03-14/102026529712.shtml,省教育厅副厅长杨德林到绩溪调研（图）,,,对徽州学校烹饪实训基地高定位的特色设置和校企合作的办学模式表示肯定。杨德林还就校园文化建设与徽文化传承、学校基础设施建设与发挥效益提出了殷切的希望。,,,
2013-03-06,中国新闻网,,http://news.sina.com.cn/c/2013-03-06/183726448749.shtml,陈世强：厚重“大别山情结” _fin,,,大别山情结”。大别山区横跨河南、湖北、安徽三省6市，中原文化、楚文化、徽文化交错融合，是中国著名的革命老区之一，当年“刘邓大军”挺进大别山让其家喻户晓。,,,
2013-03-06,新华网,,http://sports.sina.com.cn/o/2013-03-06/10356451283.shtml,第八届黟县国际山地车节4月举行 600多名选手参赛,,,国家旅游局等列为中国体育旅游精品推介项目。黟县是全国历史最为悠久的文明古县之一，也是“徽商”和“徽文化”的发祥地之一。,,,
2013-03-05,东方今报,,http://news.sina.com.cn/o/2013-03-05/071926429196.shtml,聚焦全国两会 把大别山区打造成13亿人的大氧吧,,,大别山区是国家确定的重要生态功能区，自然资源丰富，生态影响面积宽广，可开发利用的生态和红色旅游资源众多，中原文化、楚文化和徽文化交错融合，影响深远。,,,
2013-03-02,中国新闻网,,http://news.sina.com.cn/c/2013-03-02/165826406749.shtml,安徽举行兰花博览会 “天价兰花”多炒作,,,他说，兰文化是徽文化的重要组成部分，宋时徽州人罗墨所著《尔雅》，其中对兰花就有详尽记载，清初的徽州人鲍微省著《艺兰杂记》，成就了现代鉴赏兰花的理论，现代著名学者胡适作 ...,,,
2013-03-01,中安在线,,http://news.sina.com.cn/o/2013-03-01/054426392259.shtml,盗窃古砖雕 落网,,,白天踩好点，半夜才动手。歙县是徽文化的核心发源地，古建筑数量很多，而且散布各地，给侦破工作带来很大难度。,,,
2013-02-28,中安在线,,http://news.sina.com.cn/o/2013-02-28/092726384009.shtml,央广关注安徽旅游强省战略,,,的黄山独特旅游发展思路。他指出，这些年依托黄山风景区亮丽名片，有效带动了黄山全市旅游的发展，尤其带动了黄山脚下丰厚的极具特色的徽文化旅游资源的发展。,,,
2013-02-28,大江网-江西日报,,http://collection.sina.com.cn/cqyw/20130228/0717105022.shtml,农民建私人美术馆实现文化梦,,,进行艺术交流。为进一步凝聚人气，扩大影响，美术馆在庆源、虹关、游山、长溪等旅游景区开辟美术创作基地，并与古徽州“一府六县”砚作名家联手，共同继承弘扬徽文化、砚文化 ...,,,
2013-02-08,新浪娱乐,,http://ent.sina.com.cn/v/m/2013-02-08/23273855542.shtml,安徽春晚举行 崔健献唱经典布莱曼登台,,,这台晚会立足安徽本土地域特色，深入挖掘徽文化、徽人物、徽事件、徽戏剧、徽舞蹈、徽式喜剧等一系列徽元素，利用传统与现代的完美嫁接，将晚会打造成一台既有安徽特色，又大众化 ...,,,
2013-02-07,中安在线,,http://news.sina.com.cn/o/2013-02-07/041626226518.shtml,这伙蟊贼 专偷百年砖雕,,,作为古徽州核心区域及徽文化发源地，黄山市的歙县、黟县等地的明清时期古建筑特色鲜明，老屋门楼上的砖雕，则是徽派古建艺术雕刻最精美、文化价值最高的构件之一。,,,
2013-02-05,中安在线,,http://news.sina.com.cn/o/2013-02-05/060826206246.shtml,安徽试点中学生研学旅行 学生可组团出去长见识,,,通过实地接触，拓展自己的视野。学生们可以走进皖南村落研究徽文化，也可以走进大型企业，或者观察自然景观增长知识。,,,
2013-02-04,新闻晚报,,http://news.sina.com.cn/o/2013-02-04/125926200545.shtml,紫砂壶的简练美学,,,时时刻刻都在想着如何将这些细节运用于紫砂壶，赋予每一把紫砂壶全然不同的内涵。”北京的故宫、云南的民俗、安徽的徽文化和木雕、山西大宅院，都是他钟情的。,,,
2013-02-01,中国新闻网,,http://news.sina.com.cn/o/2013-02-01/122326177726.shtml,黄梅徽剧新春唱响美国 丰富侨胞春节文化,,,美东安徽文教协会等华侨社团邀请，安徽省演艺集团组织的一次海外侨务文化活动，旨在以高质量的徽文化传统艺术，丰富海外侨胞春节文化生活，增强与旅美华侨社团联系。,,,
2013-01-31,中国网络电视台,,http://news.sina.com.cn/o/2013-01-31/190626170897.shtml,安徽卫视春晚走节约实用路线,,,皖籍”名人、徽文化成晚会特色“徽晚”历年来邀请的演员阵容，括了外籍巨星、影视演员、年轻偶像、民歌歌手、老牌歌星、草根达人等，满足各个年龄观众对明星的不同喜好。,,,
2013-01-18,新安晚报,,http://news.sina.com.cn/o/2013-01-18/083926065899.shtml,春运火车票进入“抢票时刻”,,,热线：400-0551-229 网址：www.ahjuhui.com 徽文化特色礼品定制专家！生肖贺岁金银贵金属产品隆重发行！年轻人看电影打发时间 旅客们排队进站 本报记者 陈丽卿 赵乾坤/文马杨/图（原标题 ...,,,
2013-01-15,中安在线,,http://news.sina.com.cn/o/2013-01-15/091526037651.shtml,联合国专家8月“验收”安徽大运河,,,合肥市安徽省源泉徽文化民俗博物馆，合肥子木园博物馆，临泉县临泉毛笔博物馆，马鞍山市德化堂古床博物馆，芜湖市徽商博物馆，池州市秀山门博物馆，休宁县安徽万安罗经文化博物馆 ...,,,
2013-01-10,新安晚报,,http://news.sina.com.cn/o/2013-01-10/083426001546.shtml,处分160718人,,,徽文化特色礼品定制专家！生肖贺岁金银贵金属产品隆重发行！去年各级纪检监察机关立案155144件，结案153704件，处分160718人。,,,
2013-01-09,新安晚报,,http://news.sina.com.cn/o/2013-01-09/082925991473.shtml,W,,,列为主要风险案例，希望引发全球关注。以上均据新华社电 热线：400-0551-229 网址：www.ahjuhui.com 徽文化特色礼品定制专家！生肖贺岁金银贵金属产品隆重发行！（原标题：W ...,,,
2013-01-08,新安晚报,,http://news.sina.com.cn/o/2013-01-08/083425982205.shtml,新农合补助 将增至280元,,,综合新华社电 热线：400-0551-229 网址：www.ahjuhui.com 徽文化特色礼品定制专家！生肖贺岁金银贵金属产品隆重发行！（原标题：新农合补助 将增至280元 ...,,,
2013-01-07,中安在线,,http://news.sina.com.cn/o/2013-01-07/155625975967.shtml,滁州旅游总布局为“一城两核三区”,,,在定位各不相同的十大主题旅游功能区中，滁州市的琅琊山-大明文化旅游功能区与我省其他地方的黄山-徽文化、九华山-佛教文化、天柱山-黄梅戏文化等旅游功能区并列。,,,
2013-01-07,中安在线,,http://news.sina.com.cn/o/2013-01-07/121025974857.shtml,市长宋国权《政府工作报告》摘要,,,成功举办纪念邓小平同志“黄山谈话”三十周年、黄山国际旅游节暨徽文化节、第四届中国国际徽商大会、第5届世界传统武术锦标赛、首届中国(黄山)非物质文化遗产传统技艺大展、国际登 ...,,,
2013-01-06,中安在线,,http://news.sina.com.cn/o/2013-01-06/171725967849.shtml,黄山：市六届人大一次会议隆重开幕(图),,,切实抓好节能减排和资源节约利用;繁荣发展文化事业和文化产业。加大徽文化的保护和传承力度，优化公共文化服务，加快发展文化产业;全力保障和改善民生。,,,
2013-01-04,新安晚报,,http://news.sina.com.cn/o/2013-01-04/082925950957.shtml,新闻亲近百姓 更能温暖人心,,,合肥市第二人民医院护士童春香 热线：400-0551-229 网址：www.ahjuhui.com 徽文化特色礼品定制专家！生肖贺岁金银贵金属产品隆重发行！（原标题：新闻亲近百姓 更能温暖人心 ...,,,
2012-12-28,新安晚报,,http://news.sina.com.cn/o/2012-12-28/083925915471.shtml,热线：400-0551-229 网址：www.ahjuhui.com,,,维生素护肤安全有效 品牌热线：0551-64208358 省内各大药房均有销售 品牌药妆 徽文化特色礼品定制专家！生肖贺岁金银贵金属产品隆重发行！0551-63618238网址：www.hfhmzf.com 地址：合肥市蜀山区 ...,,,
2012-12-26,中安在线,,http://news.sina.com.cn/o/2012-12-26/101325897574.shtml,马鞍山将打造新型休闲旅游城,,,在这份未来几年全省旅游发展的“蓝皮书”中，明确了全省各地将打造黄山与徽文化旅游功能区、主题公园与诗词文化旅游功能区等十大不同的旅游功能区，重点建设“徽文化”体验之旅 ...,,,
2012-12-26,证券时报网,,http://finance.sina.com.cn/stock/gujiayidong/20121226/094914119494.shtml,酒店旅游股走高 九龙山大涨5.4%,,,补位”。据介绍，十大功能区包括黄山与徽文化旅游功能区、九华山佛教文化与同文化旅游功能区等，25个夜景游览区包括黄山率水-新安江夜游、黄山不夜城、九华山夜游等。,,,
2012-12-25,中安在线,,http://news.sina.com.cn/o/2012-12-25/093225888323.shtml,黄山合肥芜湖将成旅游“中心城”,,,黄山与徽文化旅游功能区、九华山佛教文化与铜文化旅游功能区、天柱山与黄梅戏文化旅游功能区、大别山多彩旅游功能区、巢湖温泉与都市文化旅游功能区、主题公园与诗词文化旅游功能 ...,,,
2012-12-20,新安晚报,,http://news.sina.com.cn/o/2012-12-20/083025854890.shtml,古井老八大酒,,,安徽古井贡酒股份有限公司荣誉出品 刊登热线：0551-62622755 栏花广告 新闻身边的广告 小投入大回报 徽文化特色礼品定制专家！生肖贺岁金银贵金属产品隆重发行！热线：400-0551-229 网址：www ...,,,
2012-12-13,新安晚报,,http://news.sina.com.cn/o/2012-12-13/083425801633.shtml,今天上午，交通厅长等你提问,,,的代表之一，他很期待今天与厅长的交流。他认为，在新桥机场、高速公路出入口等“窗口”地方，应该加强文化建设，凸显出安徽省的徽文化特色。,,,
2012-12-12,中安在线,,http://news.sina.com.cn/o/2012-12-12/103525792507.shtml,徽派“非遗”大师京城献艺,,,据合肥日报报道，徽山徽人徽文化，古香古韵古徽州。12月7日至9日，“2012中国(北京)徽文化艺术品展览会”在北京中国国际贸易中心举行。,,,
2012-12-03,中安在线,,http://news.sina.com.cn/o/2012-12-03/060525714882.shtml,安徽青年发展论坛在北大举行 为家乡发展献计献策,,,霍邱县，对当地企业发展提出自己的理解与建议；2011年，研究会走进皖南，感受徽文化的人文意蕴，考察分析当地旅游经济发展和自然资源开发利用；今年夏天考察滁州市，对安徽省不同 ...,,,
2012-11-27,国家粮食局,,http://finance.sina.com.cn/nongye/nygd/20121127/095913810026.shtml,安徽省粮食局领导视察黄山区粮食产业园,,,黄山区粮食产业园因地制宜，依山建园，功能配套，并将徽文化和粮食文化融为一体接入园中，美化了环境，提高了园区的品味和档次。,,,
2012-11-23,中国青年报,,http://news.sina.com.cn/o/2012-11-23/033925642884.shtml,安徽旅游欧亚宣传推广之旅启动,,,据了解，本活动特别采用跨国自驾车的方式，完成对欧亚大陆的穿越，并将在沿途举办旅游文化座谈、徽文化品鉴会、街头文化推广等丰富多彩的活动，与途经国家和地区进行全面互动 ...,,,
2012-11-19,中安在线,,http://news.sina.com.cn/o/2012-11-19/005825606240.shtml,跨国自驾3万里展徽风皖韵,,,穿越欧亚大陆10个国家18个重点城市，行程15000公里，以“旅游·难忘安徽”为传播主题，让安徽旅游国际化的整体形象及徽文化的独特魅力在国际舞台上得到更好的传播和展示。,,,
2013-01-18,中安在线,,http://news.sina.com.cn/o/2013-01-18/045226062789.shtml,科学履职建睿言 服务发展献良策,,,黄梅戏艺术中心和再芬黄梅戏艺术剧院还演出整台黄梅戏，成为很多游客夜间文化旅游生活的必看节目。徽文化是安徽亮丽的文化名片。保护和挖掘徽文化，委员们不遗余力。,,,
2013-01-08,中安在线,,http://news.sina.com.cn/o/2013-01-08/052525979585.shtml,“五连冠”的启示,,,省文明办有关负责人说。安徽，这块古老而又神奇的土地上，中原文化、淮河文化、徽文化三大文化圈源远流长，孕育出江淮大地淳朴民风，累积了崇德向善的文化底蕴。,,,
2012-12-26,证券时报网,,http://finance.sina.com.cn/stock/t/20121226/094414119512.shtml,酒店旅游股走高 九龙山大涨5.4%,,,补位”。据介绍，十大功能区包括黄山与徽文化旅游功能区、九华山佛教文化与同文化旅游功能区等，25个夜景游览区包括黄山率水-新安江夜游、黄山不夜城、九华山夜游等。,,,
2012-12-26,证券时报网,,http://finance.sina.com.cn/stock/t/20121226/073914117132.shtml,26日可能影响股价重要行业消息及点评（直播中）,,,点评：据中证报报道，据介绍，十大功能区包括黄山与徽文化旅游功能区、九华山佛教文化与同文化旅游功能区等，25个夜景游览区包括黄山率水-新安江夜游、黄山不夜城、九华山夜游等 ...,,,
2012-12-25,中安在线,,http://news.sina.com.cn/o/2012-12-25/020825883981.shtml,全省将打造25个“旅游不夜城”,,,黄山与徽文化旅游功能区、九华山佛教文化与铜文化旅游功能区、天柱山与黄梅戏文化旅游功能区、大别山多彩旅游功能区、巢湖温泉与都市文化旅游功能区、主题公园与诗词文化旅游功能 ...,,,
2012-12-18,新安晚报,,http://news.sina.com.cn/o/2012-12-18/082925836713.shtml,热线：400-0551-229 网址：www.ahjuhui.com,,,徽文化特色礼品定制专家！生肖贺岁金银贵金属产品隆重发行！★市场广阔：前景光明，有人居住的地方，就有人需要我们的服务；★运作模式：产品无需推广，就能走进千家万户； ...,,,
2012-12-15,法制日报,,http://news.sina.com.cn/o/2012-12-15/141925819942.shtml,安徽政法文化建设提振干警“精气神”,,,徽文化”强警② 本报记者李光明 走进安徽省蚌埠市中级人民法院院史陈列室，让人仿佛置身于古今法治文化的时光隧道。,,,
2012-12-13,大江网-江西日报,,http://news.sina.com.cn/c/2012-12-13/011925797558.shtml,婺源发掘“文化富矿”激发活力,,,本报婺源讯（记者张弛 通讯员汪炬星、吕富来）新建成的江湾景区“徽文化大观园”内，古戏台上傩舞、徽剧、戏曲引人驻足流连；百工坊内甲路纸伞厅、民间剪纸厅、有鸿徽雕厅等民俗 ...,,,
2012-11-22,新京报,,http://news.sina.com.cn/o/2012-11-22/124325638387.shtml,书法展现“徽文化”,,,作品不仅体现了时代特点，更集中展示了近年来安徽书法界在继承传统徽派书法基础上的创新成果，书写了皖山徽水的秀丽风景，弘扬了底蕴雄厚博大精深的“徽文化”。,,,
2012-11-16,中安在线,,http://news.sina.com.cn/o/2012-11-16/040325590997.shtml,"寻找""最美徽姑娘"" 第六届安徽青年模特大赛开始报名",,,记者今天上午从第六届安徽青年模特大赛新闻发布会上获悉，大赛将在本月中旬开始接受报名，本次大赛将突出“徽文化”特色，将更注重参赛模特的内在修养。,,,
2012-11-14,上海证券报,,http://finance.sina.com.cn/stock/t/20121114/015513664702.shtml,皖南国际旅游文化示范区获批,,,皖南是安徽省旅游资源分布最密、品位最高、品种最全的区域，有着名山与秀水、人文与生态的多维最佳组合，其中有以黄山为中心的世界遗产和徽文化旅游区等 ...,,,
2012-11-12,中安在线,,http://news.sina.com.cn/o/2012-11-12/055525558551.shtml,安徽旅游商品展示交易总汇在黄山举行,,,11日，安徽旅游商品展示交易总汇在黄山举行，来自安徽、江苏、浙江、云南等10多个省300多家客商参展，很多蕴含徽文化的传统手工艺品，尤其是“非遗”项目，如灵璧磬石雕、望江挑花 ...,,,
2012-11-12,中安在线,,http://news.sina.com.cn/o/2012-11-12/055025558515.shtml,休闲度假、健康养生 黄山区举办旅游休闲论坛,,,本届论坛是第十六届黄山国际旅游节暨徽文化节系列活动之一，与会专家学者围绕国际旅游休闲发展趋势、中国旅游休闲发展现状、旅游营销新时代、著名旅游商品品牌建立、中国旅游地产 ...,,,
2012-11-12,国际在线,,http://news.sina.com.cn/o/2012-11-12/052425558280.shtml,数百名国际旅行商汇聚黄山探讨旅游合作(组图),,,黄山国际旅游节暨徽文化节现场 原标题：数百名国际旅行商汇聚黄山探讨旅游合作 国际在线报道（记者 耿海艳）：一年一度的中国黄山国际旅游节暨徽文化节11日在安徽省黄山市拉开序幕 ...,,,
2016-06-13,新浪旅游,,http://travel.sina.com.cn/domestic/pages/2016-08-17/detail-ifxszfak3690643.shtml,黟县，品味宏村的清幽之美,,,黟县，是我国东晋诗人陶渊明所向往的古黟桃源里，就在这里诞生了那篇著名的《桃花源记》，这里也是徽商和徽文化的发祥地，在世界遗产名录中就有黄山、宏村和西递，黟县的青山绿水 ...,,,
2016-06-04,红网,,http://news.sina.com.cn/o/2016-06-04/doc-ifxsvexw8399572.shtml,莫让黄山改名成了闹剧,,,人们到徽州寻根，更多的是寻的文化的根，而不是行政区划上的那个名字，到宣城市的绩溪是寻根，到江西省上饶市的婺源也是寻根，只要守住徽文化的根脉，神州何处不徽州。,,,
2016-06-03,中国新闻网,,http://news.sina.com.cn/o/2016-06-03/doc-ifxsuypf4873610.shtml,古民居保护的黄山“模式”：守住徽文化“筋骨肉”,,,原标题：古民居保护的黄山“模式”：守住徽文化“筋骨肉”中新社黄山6月3日电 题：古民居保护的黄山“模式”：守住徽文化“筋骨肉”作者 张强 黄山市是徽文化的发祥地、皖南民居集 ...,,,
2016-06-01,京华时报,,http://news.sina.com.cn/o/2016-06-01/doc-ifxsqyku0122517.shtml,黄山首任市长：是时候改回来了,,,黄山市歙县地方志办公室主任胡武林对此强烈支持。“徽州是一个历史整体，从宋朝改徽州府开始到现在800年，所有徽文化体系里的东西都有徽州这个主体。,,,
2016-05-28,中国新闻网,,http://news.sina.com.cn/o/2016-05-28/doc-ifxsqtya6378264.shtml,徽州工匠的坚守：一生做好一件事,,,题：徽州工匠的坚守：一生做好一件事 作者张强 安徽省黄山市是徽文化的发祥地，是一个“盛产”能工巧匠的地方。,,,
2016-04-14,上海证券报,,http://finance.sina.com.cn/roll/2016-04-14/doc-ifxriqqx2372779.shtml,黄山旅游发展股份有限公司,,,徽菜餐饮业务：作为新兴战略板块，徽文化主题餐饮板块依托黄山旅游品牌、资源、资金、人才、技术和管理优势，打造独具特色的文化餐饮品牌。,,,
2015-11-16,中国青年报,,http://news.sina.com.cn/o/2015-11-16/doc-ifxkrwks3997598.shtml,第二届徽州国际乡村慢步大会开幕,,,成立于1987年的徽州区是安徽省辖黄山市的中心城区，位于黄山风景区南麓，是古徽州域名的唯一传承地、徽文化深度体验区，是黄山脚下一颗璀璨的明珠，是古徽商的重要聚集地和徽文化发 ...,,,
2015-11-15,中国新闻网,,http://news.sina.com.cn/o/2015-11-15/doc-ifxkrwks3980637.shtml,徒步箬岭古道 感受隋唐遗风,,,该镇旅游资源十分丰富，辖区内江村具有1400多年的历史，村内历史文化底蕴深厚，古牌坊、古祠堂、古民居融为一体，是徽文化研究和旅游观光的胜地，2005年被国家评为“历史文化名村”和 ...,,,
2015-05-24,中国新闻网,,http://news.sina.com.cn/c/2015-05-24/223231870642.shtml,安徽黄山徽州古城举办首届汉式集体婚礼,,,以“重回汉唐·爱在徽州”为主题，旨在迎合时下年轻人潮流，让人感受传统婚仪的独特魅力，使新人间的浪漫更加厚重、典雅，加强徽文化的有效传播。,,,
2015-05-14,中国新闻网,,http://news.sina.com.cn/c/2015-05-14/213531833377.shtml,二十余家世界华文媒体聚焦安徽,,,据了解，本次海外华文媒体安徽行以“行走皖南路、体验徽文化”为主题，来自美国、加拿大、澳大利亚、英国、波兰等15个国家的23家海外华文媒体通过实地采访深度了解皖南，着重加强徽 ...,,,
2015-05-08,正义网-检察日报,,http://news.sina.com.cn/o/2015-05-08/005931806109.shtml,走进皖南古村落,,,走进了淳朴的人家，古风、古韵、古朴、古貌，我在领略皖南的山、皖南的水、皖南的村落、皖南的风俗中，更领略了深奥无穷的皖南西递古村落的徽文化。,,,
2015-04-28,大江网-江西日报,,http://news.sina.com.cn/o/2015-04-28/015931768056.shtml,婺源文化深度游受青睐,,,走进徽文化底蕴深厚的婺源乡村，了解传统砚艺、制墨、造纸艺术，观赏古村祭祀、婚丧、庆典活动，体验和感受传统文化的独特魅力。,,,
2015-04-22,红网,,http://news.sina.com.cn/o/2015-04-22/003131744285.shtml,安徽大学：融合学科优势 发展协同创新,,,两个协同创新中心被认定为省级协同创新中心。围绕省委省政府“建设文化强省”战略目标，联合安徽省委宣传部、黄山市人民政府等单位共同组建“徽文化传承与创新中心”；围绕国 ...,,,
2015-04-20,山西新闻网,,http://news.sina.com.cn/o/2015-04-20/111431737940.shtml,2015歙县第二届新安江山水画廊国际马拉松开跑在即,,,文化之邦”美誉，是中国三大地域文化之一 徽文化的主要发祥地和集中展示地，也是著名的“中国徽墨之都”和“中国歙砚之乡”。,,,
2015-04-14,安徽商报,,http://news.sina.com.cn/c/2015-04-14/103931715593.shtml,宣酒借皖南旅游东风启动工业游,,,好风景成就万人游 宣城这块灵山宝地，是徽文化的发祥地之一，历代名人荟萃，产生过众多的名篇著作。,,,
2014-10-28,湖南日报,,http://news.sina.com.cn/c/2014-10-28/071931055173.shtml,安徽来湘推销高铁旅游,,,全省5A景区达7家。既可体验徽文化、三国文化、大明文化、楚文化，欣赏黄梅戏、阜阳剪纸、蚌埠花鼓灯、亳州泥塑、泗州戏等民俗风情；还可品尝臭鳜鱼、毛豆腐、亳州药膳等美食 ...,,,
